{
  "_storage": "TEMPORARY_LOCAL_SCAFFOLD",
  "_warning": "NOT PRODUCT STORAGE. NOT AUTHORITATIVE. Parallel to library/library.json until explicit migration.",
  "storage_schema_version": 3,
  "supabase_mirror_version": 1,
  "professional_account": {
    "id": "acct_local_1",
    "display_name": "Local Professional",
    "schema_version": 1,
    "created_at": "2026-05-29T00:00:00+00:00",
    "updated_at": "2026-05-29T00:00:00+00:00"
  },
  "user_settings": {
    "settings_version": 1,
    "house_system": "placidus",
    "zodiac_mode": "tropical",
    "orb_defaults": {
      "conjunction": 8,
      "square": 6,
      "opposition": 8,
      "trine": 8,
      "sextile": 4
    },
    "visible_minor_aspects": false,
    "helper_layers": {},
    "ontology_pack_id": null,
    "default_chart_record_id": "cr-anna-rivera",
    "updated_at": "2026-05-29T00:00:00+00:00"
  },
  "places": [
    {
      "id": "place_nyc",
      "external_source": "manual",
      "external_id": null,
      "display_name": "New York, NY",
      "admin1": "NY",
      "country_code": "US",
      "country_name": "United States",
      "lat": 40.7128,
      "lon": -74.006,
      "schema_version": 1
    },
    {
      "id": "place_portland",
      "external_source": "manual",
      "external_id": null,
      "display_name": "Portland, OR",
      "admin1": "OR",
      "country_code": "US",
      "country_name": "United States",
      "lat": 45.5152,
      "lon": -122.6784,
      "schema_version": 1
    },
    {
      "id": "place_lisbon",
      "external_source": "manual",
      "external_id": null,
      "display_name": "Lisbon, PT",
      "admin1": null,
      "country_code": "PT",
      "country_name": "Portugal",
      "lat": 38.7223,
      "lon": -9.1393,
      "schema_version": 1
    },
    {
      "id": "place_austin",
      "external_source": "manual",
      "external_id": null,
      "display_name": "Austin, TX",
      "admin1": "TX",
      "country_code": "US",
      "country_name": "United States",
      "lat": 30.2672,
      "lon": -97.7431,
      "schema_version": 1
    },
    {
      "id": "place_chicago",
      "external_source": "manual",
      "external_id": null,
      "display_name": "Chicago, IL",
      "admin1": "IL",
      "country_code": "US",
      "country_name": "United States",
      "lat": 41.8781,
      "lon": -87.6298,
      "schema_version": 1
    },
    {
      "id": "place_denver",
      "external_source": "manual",
      "external_id": null,
      "display_name": "Denver, CO",
      "admin1": "CO",
      "country_code": "US",
      "country_name": "United States",
      "lat": 39.7392,
      "lon": -104.9903,
      "schema_version": 1
    },
    {
      "id": "place_stonehenge",
      "external_source": "manual",
      "external_id": null,
      "display_name": "Stonehenge, UK",
      "admin1": null,
      "country_code": "GB",
      "country_name": "United Kingdom",
      "lat": 51.1789,
      "lon": -1.8262,
      "schema_version": 1
    },
    {
      "id": "place_london",
      "external_source": "manual",
      "external_id": null,
      "display_name": "London, UK",
      "admin1": null,
      "country_code": "GB",
      "country_name": "United Kingdom",
      "lat": 51.5074,
      "lon": -0.1278,
      "schema_version": 1
    }
  ],
  "birth_profiles": [
    {
      "id": "bp_anna",
      "birth_date": "1990-03-15",
      "birth_time": "07:42",
      "birth_place_id": "place_nyc",
      "timezone_id": "America/New_York",
      "confidence_tier": "T0",
      "confidence_metadata": {},
      "representative_time": null,
      "schema_version": 1,
      "updated_at": "2026-05-29T00:00:00+00:00"
    },
    {
      "id": "bp_jordan",
      "birth_date": "1985-11-02",
      "birth_time": null,
      "birth_place_id": "place_chicago",
      "timezone_id": "America/Chicago",
      "confidence_tier": "T2",
      "confidence_metadata": {
        "time_range_display": "9:47 AM–12:30 PM",
        "source": "user_declared_bounded_range"
      },
      "representative_time": null,
      "schema_version": 1,
      "updated_at": "2026-05-29T00:00:00+00:00"
    },
    {
      "id": "bp_research",
      "birth_date": "2024-06-21",
      "birth_time": "12:00",
      "birth_place_id": "place_stonehenge",
      "timezone_id": "Europe/London",
      "confidence_tier": "T0",
      "confidence_metadata": {},
      "representative_time": null,
      "schema_version": 1,
      "updated_at": "2026-05-29T00:00:00+00:00"
    }
  ],
  "clients": [
    {
      "id": "cr-anna-rivera",
      "display_name": "Anna Rivera",
      "birth_profile_id": "bp_anna",
      "record_type": "self",
      "current_location_place_id": "place_portland",
      "notes": "",
      "tags": [],
      "schema_version": 1,
      "updated_at": "2026-05-29T00:00:00+00:00"
    },
    {
      "id": "cr-jordan-lee",
      "display_name": "Jordan Lee",
      "birth_profile_id": "bp_jordan",
      "record_type": "client",
      "current_location_place_id": null,
      "notes": "",
      "tags": [],
      "schema_version": 1,
      "updated_at": "2026-05-29T00:00:00+00:00"
    },
    {
      "id": "cr-research-event",
      "display_name": "Research — Summer solstice study",
      "birth_profile_id": "bp_research",
      "record_type": "research",
      "current_location_place_id": null,
      "notes": "",
      "tags": ["research"],
      "schema_version": 1,
      "updated_at": "2026-05-29T00:00:00+00:00"
    }
  ],
  "saved_investigations": [
    {
      "id": "exp-a1",
      "client_id": "cr-anna-rivera",
      "birth_profile_id": "bp_anna",
      "originating_chart_record_id": "cr-anna-rivera",
      "title": "Sun 10th + ASC Gemini",
      "name": "Sun 10th + ASC Gemini",
      "notes": "",
      "conditions": {
        "schema_version": 1,
        "kind": "saved_investigation",
        "tracks": [
          {"type": "planet_in_house", "planet": "sun", "house": 10},
          {"type": "angle_in_sign", "angle": "asc", "sign": "gemini"}
        ]
      },
      "viewport": {
        "center_lat": 45.5152,
        "center_lon": -122.6784,
        "zoom": 4.0
      },
      "settings_snapshot": {
        "settings_version": 1,
        "house_system": "placidus",
        "zodiac_mode": "tropical",
        "settings_snapshot_version": 1
      },
      "settings_snapshot_version": 1,
      "layer_display_state": {},
      "default_reopen_mode": "keep_snapshot",
      "schema_version": 1,
      "updated_at": "2026-05-29T00:00:00+00:00"
    },
    {
      "id": "exp-a2",
      "client_id": "cr-anna-rivera",
      "birth_profile_id": "bp_anna",
      "originating_chart_record_id": "cr-anna-rivera",
      "title": "Aspect to MC probe",
      "name": "Aspect to MC probe",
      "notes": "",
      "conditions": {
        "schema_version": 1,
        "kind": "saved_investigation",
        "tracks": [
          {"type": "aspect_to_angle", "planet": "mars", "angle": "mc", "aspect": "square"}
        ]
      },
      "viewport": {
        "center_lat": 38.7223,
        "center_lon": -9.1393,
        "zoom": 5.0
      },
      "settings_snapshot": {
        "settings_version": 1,
        "house_system": "placidus",
        "zodiac_mode": "tropical",
        "settings_snapshot_version": 1
      },
      "settings_snapshot_version": 1,
      "layer_display_state": {},
      "default_reopen_mode": "keep_snapshot",
      "schema_version": 1,
      "updated_at": "2026-05-29T00:00:00+00:00"
    },
    {
      "id": "exp-j1",
      "client_id": "cr-jordan-lee",
      "birth_profile_id": "bp_jordan",
      "originating_chart_record_id": "cr-jordan-lee",
      "title": "Angle-in-sign scan (blocked — honest tier)",
      "name": "Angle-in-sign scan (blocked — honest tier)",
      "notes": "",
      "conditions": {
        "schema_version": 1,
        "kind": "saved_investigation",
        "tracks": [
          {"type": "angle_in_sign", "angle": "mc", "sign": "capricorn"}
        ]
      },
      "viewport": {
        "center_lat": 41.8781,
        "center_lon": -87.6298,
        "zoom": 4.0
      },
      "settings_snapshot": {
        "settings_version": 1,
        "house_system": "placidus",
        "zodiac_mode": "tropical",
        "settings_snapshot_version": 1
      },
      "settings_snapshot_version": 1,
      "layer_display_state": {},
      "default_reopen_mode": "keep_snapshot",
      "schema_version": 1,
      "updated_at": "2026-05-29T00:00:00+00:00"
    },
    {
      "id": "exp-r1",
      "client_id": "cr-research-event",
      "birth_profile_id": "bp_research",
      "originating_chart_record_id": "cr-research-event",
      "title": "Research · Sun angle study",
      "name": "Research · Sun angle study",
      "notes": "",
      "conditions": {
        "schema_version": 1,
        "kind": "saved_investigation",
        "tracks": [
          {"type": "planet_in_house", "planet": "sun", "house": 10}
        ]
      },
      "viewport": {
        "center_lat": 51.5074,
        "center_lon": -0.1278,
        "zoom": 6.0
      },
      "settings_snapshot": {
        "settings_version": 1,
        "house_system": "placidus",
        "zodiac_mode": "tropical",
        "settings_snapshot_version": 1
      },
      "settings_snapshot_version": 1,
      "layer_display_state": {},
      "default_reopen_mode": "keep_snapshot",
      "schema_version": 1,
      "updated_at": "2026-05-29T00:00:00+00:00"
    }
  ],
  "favorite_cities": [
    {
      "id": "fav-a1",
      "client_id": "cr-anna-rivera",
      "place_id": "place_portland",
      "saved_investigation_id": "exp-a1",
      "notes": "",
      "sort_order": 0,
      "schema_version": 1
    },
    {
      "id": "fav-a2",
      "client_id": "cr-anna-rivera",
      "place_id": "place_lisbon",
      "saved_investigation_id": null,
      "notes": "",
      "sort_order": 1,
      "schema_version": 1
    },
    {
      "id": "fav-a3",
      "client_id": "cr-anna-rivera",
      "place_id": "place_austin",